{
  "$schema": "../../engine/schema/plan.schema.json",
  "version": 2,
  "id": "",
  "title": "",
  "subtitle": "",
  "lang": "en",
  "accent": "neutral",
  "execution": "auto",
  "source": { "kind": "request" },
  "summary": { "goal": "The intended result in one sentence.", "changes": ["The concrete change"], "risks": ["The main known limitation"] },
  "context": "The request in two or three sentences, the scope, what already exists.",
  "phases": [
    { "id": "p1", "title": "First phase", "estimate": "≈ 1 d", "days": 1 }
  ],
  "glossary": [],
  "pages": [
    {
      "id": "theme-1",
      "section": "1 · First theme",
      "title": "Page title",
      "intro": "What this page asks you to decide, in one sentence.",
      "decisions": [
        {
          "id": "D1",
          "title": "A decision that can be settled on its own",
          "importance": "important",
          "phase": "p1",
          "why": "Why it matters: the context, and what a mistake would cost.",
          "benefit": "The concrete benefit for the person.",
          "tradeoff": "The main known compromise or risk.",
          "proposal": "What is proposed, in plain words.",
          "tasks": [
            {
              "id": "t1",
              "title": "First task",
              "do": "What to do, concretely.",
              "files": [{ "path": "src/example.js", "op": "create" }],
              "acceptance": ["A verifiable criterion"],
              "verify": ["npm test"]
            }
          ]
        }
      ]
    }
  ]
}
